{
  "schema": "alchemy.autobuild.integration/0.1",
  "package": {
    "name": "alchemy_autobuild",
    "version": "0.2",
    "kind": "python"
  },
  "working_directory": ".",
  "environment": {
    "set": {},
    "prepend_path": []
  },
  "tests": [
    {
      "name": "acceptance",
      "argv": [
        "python3",
        "-m",
        "unittest",
        "-v",
        "tests.test_autobuild"
      ],
      "timeout_seconds": 60
    }
  ],
  "publish": {
    "tree": {
      "source": ".",
      "path": "packages/alchemy_autobuild_v0.2"
    },
    "files": [
      {
        "source": "README.md",
        "path": "packages/alchemy_autobuild_v0.2/README.md",
        "legacy_bootstrap": true
      },
      {
        "source": "alchemy-autobuild.service.example",
        "path": "packages/alchemy_autobuild_v0.2/alchemy-autobuild.service.example",
        "legacy_bootstrap": true
      },
      {
        "source": "alchemy_autobuild.py",
        "path": "packages/alchemy_autobuild_v0.2/alchemy_autobuild.py",
        "legacy_bootstrap": true
      },
      {
        "source": "bootstrap.sh",
        "path": "packages/alchemy_autobuild_v0.2/bootstrap.sh",
        "legacy_bootstrap": true
      },
      {
        "source": "config.example.json",
        "path": "packages/alchemy_autobuild_v0.2/config.example.json",
        "legacy_bootstrap": true
      },
      {
        "source": "integration.json",
        "path": "packages/alchemy_autobuild_v0.2/integration.json",
        "legacy_bootstrap": true
      },
      {
        "source": "integration.schema.json",
        "path": "packages/alchemy_autobuild_v0.2/integration.schema.json",
        "legacy_bootstrap": true
      },
      {
        "source": "run_tests.sh",
        "path": "packages/alchemy_autobuild_v0.2/run_tests.sh",
        "legacy_bootstrap": true
      },
      {
        "source": "tests/__init__.py",
        "path": "packages/alchemy_autobuild_v0.2/tests/__init__.py",
        "legacy_bootstrap": true
      },
      {
        "source": "tests/test_autobuild.py",
        "path": "packages/alchemy_autobuild_v0.2/tests/test_autobuild.py",
        "legacy_bootstrap": true
      }
    ]
  }
}
